{
  "$schema": "http://json-schema.org/draft-07/schema#",
  "title": "Graph Edges",
  "type": "array",
  "items": {
    "type": "object",
    "required": ["id","from","to","type"],
    "properties": {
      "id": { "type": "string" },
      "from": { "type": "string" },
      "to": { "type": "string" },
      "type": { "type": "string" }
    }
  }
}
